[
  {
    "id": "ZH-HANT-001",
    "revision": 1,
    "title_zh_hant": "明示語言、字體系統與地區",
    "requirement_en": "Resolve only explicit zh-Hant-TW or zh-Hant-HK plus a supported medium; never infer region from Han characters.",
    "kind": "project-policy",
    "strength": "must",
    "impact": "warning",
    "media": [
      "web-editorial",
      "web-marketing",
      "web-ui",
      "report-document",
      "presentation",
      "display-copy"
    ],
    "locales": [
      "zh-Hant-TW",
      "zh-Hant-HK"
    ],
    "source_refs": [
      "ZH-POLICY",
      "CLREQ"
    ],
    "source_sections": {
      "ZH-POLICY": "revision 1",
      "CLREQ": "1.2"
    },
    "conditions": [
      {
        "when": "Apply to the explicitly selected regional context, writing mode, text role and authorized target only.",
        "impact": "warning",
        "scope": "named text segment or observed output"
      }
    ],
    "verification": {
      "method": "static",
      "coverage": "implemented",
      "notes": "Selection only; tools/locale_resolver.py rejects unknown contexts."
    },
    "fix_policy": {
      "mode": "explicit-refine",
      "protected_content": [
        "source text, names, numbers, punctuation, Unicode sequences"
      ],
      "guidance": "Never auto-rewrite supplied content. Apply layout advice only inside authorized scope; audit stays read-only."
    },
    "exception_policy": {
      "allowed": false,
      "bounds": "Record original quotes, code, URLs, proper names and house style as scoped context; no silent regional substitution.",
      "approval_required": true
    },
    "case_ids": []
  },
  {
    "id": "ZH-HANT-002",
    "revision": 1,
    "title_zh_hant": "保留地區字形與異體字",
    "requirement_en": "Keep supplied character identities and variation sequences. Inspect glyphs with the actual regional language tag and available licensed font; do not replace 臺/台 or 裏/裡 automatically.",
    "kind": "project-policy",
    "strength": "should",
    "impact": "warning",
    "media": [
      "web-editorial",
      "web-marketing",
      "web-ui",
      "report-document",
      "presentation",
      "display-copy"
    ],
    "locales": [
      "zh-Hant-TW",
      "zh-Hant-HK"
    ],
    "source_refs": [
      "CLREQ",
      "ZH-POLICY"
    ],
    "source_sections": {
      "CLREQ": "4.1; 3.1",
      "ZH-POLICY": "revision 1"
    },
    "conditions": [
      {
        "when": "Apply to the explicitly selected regional context, writing mode, text role and authorized target only.",
        "impact": "warning",
        "scope": "named text segment or observed output"
      }
    ],
    "verification": {
      "method": "rendered",
      "coverage": "guidance-only",
      "notes": "Glyph appearance is separate from source identity; no glyph detector."
    },
    "fix_policy": {
      "mode": "explicit-refine",
      "protected_content": [
        "source text, names, numbers, punctuation, Unicode sequences"
      ],
      "guidance": "Never auto-rewrite supplied content. Apply layout advice only inside authorized scope; audit stays read-only."
    },
    "exception_policy": {
      "allowed": true,
      "bounds": "Record original quotes, code, URLs, proper names and house style as scoped context; no silent regional substitution.",
      "approval_required": true
    },
    "case_ids": []
  },
  {
    "id": "ZH-HANT-003",
    "revision": 1,
    "title_zh_hant": "臺灣引號體例",
    "requirement_en": "For newly authored Taiwan prose, recommend 「」 outside and 『』 inside when no house style is specified. Original quotes, proper names and agreed alternate styles stay unchanged.",
    "kind": "project-policy",
    "strength": "should",
    "impact": "warning",
    "media": [
      "web-editorial",
      "web-marketing",
      "web-ui",
      "report-document",
      "presentation",
      "display-copy"
    ],
    "locales": [
      "zh-Hant-TW"
    ],
    "source_refs": [
      "TW-MOE",
      "CLREQ",
      "ZH-POLICY"
    ],
    "source_sections": {
      "TW-MOE": "引號",
      "CLREQ": "5.2",
      "ZH-POLICY": "revision 1"
    },
    "conditions": [
      {
        "when": "Apply to the explicitly selected regional context, writing mode, text role and authorized target only.",
        "impact": "warning",
        "scope": "named text segment or observed output"
      }
    ],
    "verification": {
      "method": "static",
      "coverage": "implemented",
      "notes": "runtime/checks.py flags curly quotes only in explicitly classified prose under corner style; no nesting or completeness detector."
    },
    "fix_policy": {
      "mode": "explicit-refine",
      "protected_content": [
        "source text, names, numbers, punctuation, Unicode sequences"
      ],
      "guidance": "Never auto-rewrite supplied content. Apply layout advice only inside authorized scope; audit stays read-only."
    },
    "exception_policy": {
      "allowed": true,
      "bounds": "Record original quotes, code, URLs, proper names and house style as scoped context; no silent regional substitution.",
      "approval_required": true
    },
    "case_ids": []
  },
  {
    "id": "ZH-HANT-004",
    "revision": 1,
    "title_zh_hant": "香港引號體例另行確認",
    "requirement_en": "For Hong Kong, record the publisher or document-specific quote style. Do not import Taiwan educational conventions as a universal Hong Kong rule; preserve original corner or curly quotation until a style is chosen.",
    "kind": "project-policy",
    "strength": "should",
    "impact": "warning",
    "media": [
      "web-editorial",
      "web-marketing",
      "web-ui",
      "report-document",
      "presentation",
      "display-copy"
    ],
    "locales": [
      "zh-Hant-HK"
    ],
    "source_refs": [
      "CLREQ",
      "ZH-POLICY"
    ],
    "source_sections": {
      "CLREQ": "5.1 regional note; 5.2",
      "ZH-POLICY": "revision 1"
    },
    "conditions": [
      {
        "when": "Apply to the explicitly selected regional context, writing mode, text role and authorized target only.",
        "impact": "warning",
        "scope": "named text segment or observed output"
      }
    ],
    "verification": {
      "method": "static",
      "coverage": "implemented",
      "notes": "Checker emits a quote candidate only when caller explicitly chooses corner; no default Hong Kong style and no compliance claim."
    },
    "fix_policy": {
      "mode": "explicit-refine",
      "protected_content": [
        "source text, names, numbers, punctuation, Unicode sequences"
      ],
      "guidance": "Never auto-rewrite supplied content. Apply layout advice only inside authorized scope; audit stays read-only."
    },
    "exception_policy": {
      "allowed": true,
      "bounds": "Record original quotes, code, URLs, proper names and house style as scoped context; no silent regional substitution.",
      "approval_required": true
    },
    "case_ids": []
  },
  {
    "id": "ZH-HANT-005",
    "revision": 1,
    "title_zh_hant": "區分中文正文與受保護片段",
    "requirement_en": "Consider fullwidth punctuation for newly authored Chinese prose. ASCII marks in names, URLs, code, English quotations and protected spans are not a prose-punctuation fault.",
    "kind": "project-policy",
    "strength": "should",
    "impact": "warning",
    "media": [
      "web-editorial",
      "web-marketing",
      "web-ui",
      "report-document",
      "presentation",
      "display-copy"
    ],
    "locales": [
      "zh-Hant-TW",
      "zh-Hant-HK"
    ],
    "source_refs": [
      "CLREQ",
      "ZH-POLICY"
    ],
    "source_sections": {
      "CLREQ": "5.1",
      "ZH-POLICY": "revision 1"
    },
    "conditions": [
      {
        "when": "Apply to the explicitly selected regional context, writing mode, text role and authorized target only.",
        "impact": "warning",
        "scope": "named text segment or observed output"
      }
    ],
    "verification": {
      "method": "static",
      "coverage": "implemented",
      "notes": "Only ASCII ,;:!? candidates in a caller-classified prose segment. Not an HTML parser or grammar checker; candidates remain needs-review."
    },
    "fix_policy": {
      "mode": "explicit-refine",
      "protected_content": [
        "source text, names, numbers, punctuation, Unicode sequences"
      ],
      "guidance": "Never auto-rewrite supplied content. Apply layout advice only inside authorized scope; audit stays read-only."
    },
    "exception_policy": {
      "allowed": true,
      "bounds": "Record original quotes, code, URLs, proper names and house style as scoped context; no silent regional substitution.",
      "approval_required": true
    },
    "case_ids": []
  },
  {
    "id": "ZH-HANT-006",
    "revision": 1,
    "title_zh_hant": "實際行首行尾檢視",
    "requirement_en": "Inspect observed lines for closing punctuation at a line start and opening brackets at a line end using the chosen editorial strictness. DOM punctuation alone is not a rendered violation.",
    "kind": "standard-reference",
    "strength": "should",
    "impact": "warning",
    "media": [
      "web-editorial",
      "web-marketing",
      "web-ui",
      "report-document",
      "presentation",
      "display-copy"
    ],
    "locales": [
      "zh-Hant-TW",
      "zh-Hant-HK"
    ],
    "source_refs": [
      "CLREQ",
      "UAX14"
    ],
    "source_sections": {
      "CLREQ": "6.1.1–6.1.2",
      "UAX14": "1; 6; 8"
    },
    "conditions": [
      {
        "when": "Apply to the explicitly selected regional context, writing mode, text role and authorized target only.",
        "impact": "warning",
        "scope": "named text segment or observed output"
      }
    ],
    "verification": {
      "method": "rendered",
      "coverage": "guidance-only",
      "notes": "No line-layout engine. Strictness varies by publication; source scanning cannot pass line-edge quality."
    },
    "fix_policy": {
      "mode": "explicit-refine",
      "protected_content": [